{
  "characterSheetVersion": "1.0.0",
  "header": {
    "id": "golden-bard-1",
    "name": "Lute",
    "level": 1,
    "class": { "id": "class:bard:1", "name": "Bard" }
  },
  "abilities": {
    "base": { "str": 8, "dex": 12, "con": 10, "int": 10, "wis": 10, "cha": 16 },
    "effective": { "str": 8, "dex": 12, "con": 10, "int": 10, "wis": 10, "cha": 16 }
  },
  "skills": [],
  "savingThrows": [],
  "derivedStats": {},
  "inventory": [],
  "equipment": [],
  "capabilities": [
    { "id": "cap:inspire:1", "name": "Inspire", "payloadType": null, "payload": {}, "sourceType": "class", "sourceId": "class:bard:1", "trigger": null },
    { "id": "cap:spellcasting:1", "name": "Cast Spell", "payloadType": null, "payload": {}, "sourceType": "feature", "sourceId": "feature:spellcasting", "trigger": null }
  ],
  "activeEffects": [],
  "unresolvedChoices": 0
}
